<!DOCTYPE settings SYSTEM "C:\214EC3011\PRLab\BCIUI\settings\settings.dtd">
<settings>
	<title >Brain Computer Interface Default Settings
		title
	</title>
	<singleton>
		<symbol>symbol</symbol>
		<polygon>
			<point>
				<coordinate>coordinate</coordinate>
				<coordinate>coordinate</coordinate>
			</point>
		</polygon>
		<polygon>
			<point>
				<coordinate>coordinate</coordinate>
				<coordinate>coordinate</coordinate>
			</point>
		</polygon>
	</singleton>
	<groups>
		<groupName ></groupName>
		<group />
	</groups>
	<polygon>
		<point>
			<coordinate>coordinate</coordinate>
			<coordinate>coordinate</coordinate>
		</point>
	</polygon>

</settings>